{
  "generatedAt": "2026-10-22T11:42:23+11:00",
  "generatedAtHuman": "22 October 2026, 11:42 AEDT",
  "totalTrades": 4000,
  "trackers": {
    "pelosi": {
      "name": "Nancy Pelosi",
      "chamber": "House",
      "status": "Partial — previous verified records retained",
      "trades": 102,
      "holdings": 34,
      "latestTrade": "2026-09-08",
      "latestFiling": "2026-10-02",
      "newTrades": 0,
      "errors": [
        "House pelosi 8214491: no transaction rows parsed",
        "House pelosi 20012343: no transaction rows parsed",
        "House pelosi 20016155: no transaction rows parsed",
        "House pelosi 20017123: no transaction rows parsed",
        "House pelosi 20017460: no transaction rows parsed"
      ]
    },
    "tim-moore": {
      "name": "Tim Moore",
      "chamber": "House",
      "status": "Partial — previous verified records retained",
      "trades": 105,
      "holdings": 26,
      "latestTrade": "2026-06-04",
      "latestFiling": "2026-06-05",
      "newTrades": 0,
      "errors": [
        "House tim-moore 20034952: no transaction rows parsed",
        "House tim-moore 20035291: no transaction rows parsed"
      ]
    },
    "dan-meuser": {
      "name": "Dan Meuser",
      "chamber": "House",
      "status": "Current",
      "trades": 44,
      "holdings": 8,
      "latestTrade": "2026-08-31",
      "latestFiling": "2026-10-14",
      "newTrades": 0,
      "errors": []
    },
    "cleo-fields": {
      "name": "Cleo Fields",
      "chamber": "House",
      "status": "Partial — previous verified records retained",
      "trades": 109,
      "holdings": 26,
      "latestTrade": "2026-09-10",
      "latestFiling": "2026-10-01",
      "newTrades": 0,
      "errors": [
        "House cleo-fields 20027855: no transaction rows parsed",
        "House cleo-fields 20034295: no transaction rows parsed",
        "House cleo-fields 20034357: no transaction rows parsed",
        "House cleo-fields 20034591: no transaction rows parsed",
        "House cleo-fields 20035023: no transaction rows parsed"
      ]
    },
    "rob-bresnahan": {
      "name": "Rob Bresnahan",
      "chamber": "House",
      "status": "Partial — previous verified records retained",
      "trades": 297,
      "holdings": 97,
      "latestTrade": "2026-03-06",
      "latestFiling": "2026-03-18",
      "newTrades": 0,
      "errors": [
        "House rob-bresnahan 20030336: no transaction rows parsed",
        "House rob-bresnahan 20030998: no transaction rows parsed",
        "House rob-bresnahan 20035216: no transaction rows parsed"
      ]
    },
    "donald-beyer": {
      "name": "Donald Beyer",
      "chamber": "House",
      "status": "Partial — previous verified records retained",
      "trades": 489,
      "holdings": 99,
      "latestTrade": "2026-09-15",
      "latestFiling": "2026-10-01",
      "newTrades": 0,
      "errors": [
        "House donald-beyer 20021091: no transaction rows parsed",
        "House donald-beyer 20021193: no transaction rows parsed",
        "House donald-beyer 20021447: no transaction rows parsed",
        "House donald-beyer 20022418: no transaction rows parsed",
        "House donald-beyer 20022807: no transaction rows parsed"
      ]
    },
    "josh-gottheimer": {
      "name": "Josh Gottheimer",
      "chamber": "House",
      "status": "Partial — previous verified records retained",
      "trades": 1817,
      "holdings": 395,
      "latestTrade": "2026-09-25",
      "latestFiling": "2026-10-07",
      "newTrades": 0,
      "errors": [
        "House josh-gottheimer 9110522: no transaction rows parsed",
        "House josh-gottheimer 9111258: no transaction rows parsed",
        "House josh-gottheimer 9111844: no transaction rows parsed",
        "House josh-gottheimer 9111984: no transaction rows parsed",
        "House josh-gottheimer 9112308: no transaction rows parsed"
      ]
    },
    "sheldon-whitehouse": {
      "name": "Sheldon Whitehouse",
      "chamber": "Senate",
      "status": "Current",
      "trades": 1037,
      "holdings": 134,
      "latestTrade": "2026-09-04",
      "latestFiling": "2026-10-01",
      "newTrades": 0,
      "errors": []
    }
  },
  "sourceStatus": {
    "house": {
      "filingsDiscovered": 322,
      "errors": []
    },
    "senate": {
      "errors": []
    },
    "parsing": {
      "errors": [
        "House pelosi 8214491: no transaction rows parsed",
        "House josh-gottheimer 9110522: no transaction rows parsed",
        "House josh-gottheimer 9111258: no transaction rows parsed",
        "House josh-gottheimer 9111844: no transaction rows parsed",
        "House josh-gottheimer 9111984: no transaction rows parsed",
        "House josh-gottheimer 9112308: no transaction rows parsed",
        "House josh-gottheimer 9112457: no transaction rows parsed",
        "House josh-gottheimer 9112650: no transaction rows parsed",
        "House josh-gottheimer 9112651: no transaction rows parsed",
        "House josh-gottheimer 9113462: no transaction rows parsed",
        "House josh-gottheimer 9113463: no transaction rows parsed",
        "House pelosi 20012343: no transaction rows parsed",
        "House pelosi 20016155: no transaction rows parsed",
        "House pelosi 20017123: no transaction rows parsed",
        "House pelosi 20017460: no transaction rows parsed",
        "House pelosi 20020662: no transaction rows parsed",
        "House pelosi 20020916: no transaction rows parsed",
        "House donald-beyer 20021091: no transaction rows parsed",
        "House donald-beyer 20021193: no transaction rows parsed",
        "House donald-beyer 20021447: no transaction rows parsed",
        "House pelosi 20022320: no transaction rows parsed",
        "House donald-beyer 20022418: no transaction rows parsed",
        "House donald-beyer 20022807: no transaction rows parsed",
        "House donald-beyer 20024769: no transaction rows parsed",
        "House donald-beyer 20025776: no transaction rows parsed",
        "House donald-beyer 20027932: no transaction rows parsed",
        "House cleo-fields 20027855: no transaction rows parsed",
        "House donald-beyer 20030262: no transaction rows parsed",
        "House rob-bresnahan 20030336: no transaction rows parsed",
        "House donald-beyer 20030746: no transaction rows parsed"
      ]
    },
    "filingLedger": {
      "parserVersion": "political-ptr-v3",
      "filings": 447,
      "states": {
        "parsed": 405,
        "failed": 42
      },
      "retryable": 42,
      "retryableFilings": [
        {
          "trackerId": "pelosi",
          "chamber": "House",
          "filingId": "8214491",
          "state": "failed",
          "lastError": "no transaction rows parsed",
          "nextRetryAt": "2026-10-22T12:42:27+00:00",
          "reportUrl": "https://disclosures-clerk.house.gov/public_disc/ptr-pdfs/2013/8214491.pdf"
        },
        {
          "trackerId": "josh-gottheimer",
          "chamber": "House",
          "filingId": "9110522",
          "state": "failed",
          "lastError": "no transaction rows parsed",
          "nextRetryAt": "2026-10-22T12:42:27+00:00",
          "reportUrl": "https://disclosures-clerk.house.gov/public_disc/ptr-pdfs/2017/9110522.pdf"
        },
        {
          "trackerId": "josh-gottheimer",
          "chamber": "House",
          "filingId": "9111258",
          "state": "failed",
          "lastError": "no transaction rows parsed",
          "nextRetryAt": "2026-10-22T12:42:27+00:00",
          "reportUrl": "https://disclosures-clerk.house.gov/public_disc/ptr-pdfs/2017/9111258.pdf"
        },
        {
          "trackerId": "josh-gottheimer",
          "chamber": "House",
          "filingId": "9111844",
          "state": "failed",
          "lastError": "no transaction rows parsed",
          "nextRetryAt": "2026-10-22T12:42:27+00:00",
          "reportUrl": "https://disclosures-clerk.house.gov/public_disc/ptr-pdfs/2017/9111844.pdf"
        },
        {
          "trackerId": "josh-gottheimer",
          "chamber": "House",
          "filingId": "9111984",
          "state": "failed",
          "lastError": "no transaction rows parsed",
          "nextRetryAt": "2026-10-22T12:42:27+00:00",
          "reportUrl": "https://disclosures-clerk.house.gov/public_disc/ptr-pdfs/2017/9111984.pdf"
        },
        {
          "trackerId": "josh-gottheimer",
          "chamber": "House",
          "filingId": "9112308",
          "state": "failed",
          "lastError": "no transaction rows parsed",
          "nextRetryAt": "2026-10-22T12:42:27+00:00",
          "reportUrl": "https://disclosures-clerk.house.gov/public_disc/ptr-pdfs/2018/9112308.pdf"
        },
        {
          "trackerId": "josh-gottheimer",
          "chamber": "House",
          "filingId": "9112457",
          "state": "failed",
          "lastError": "no transaction rows parsed",
          "nextRetryAt": "2026-10-22T12:42:27+00:00",
          "reportUrl": "https://disclosures-clerk.house.gov/public_disc/ptr-pdfs/2018/9112457.pdf"
        },
        {
          "trackerId": "josh-gottheimer",
          "chamber": "House",
          "filingId": "9112650",
          "state": "failed",
          "lastError": "no transaction rows parsed",
          "nextRetryAt": "2026-10-22T12:42:27+00:00",
          "reportUrl": "https://disclosures-clerk.house.gov/public_disc/ptr-pdfs/2018/9112650.pdf"
        },
        {
          "trackerId": "josh-gottheimer",
          "chamber": "House",
          "filingId": "9112651",
          "state": "failed",
          "lastError": "no transaction rows parsed",
          "nextRetryAt": "2026-10-22T12:42:28+00:00",
          "reportUrl": "https://disclosures-clerk.house.gov/public_disc/ptr-pdfs/2018/9112651.pdf"
        },
        {
          "trackerId": "josh-gottheimer",
          "chamber": "House",
          "filingId": "9113462",
          "state": "failed",
          "lastError": "no transaction rows parsed",